{
  "schemaVersion": 1,
  "id": "2026-10-08-review-overview",
  "title": "Review overview",
  "type": "review",
  "summary": "This story gives a short review plan.",
  "request": "Explain what to review",
  "author": {
    "agent": "Example agent",
    "model": "Example model"
  },
  "createdAt": "2026-10-08T12:00:00Z",
  "git": {
    "branch": null,
    "commit": null
  },
  "steps": [
    {
      "id": "overview",
      "title": "Start with the request",
      "comment": "Read the request and identify the expected result."
    },
    {
      "id": "behavior",
      "title": "Trace the changed behavior",
      "comment": "Follow the data from the entry point to the result."
    },
    {
      "id": "checks",
      "title": "Check the result",
      "comment": "Run the relevant tests and compare their coverage with the request."
    }
  ]
}
